{
  "$schema": "https://json-schema.org/draft/2020-12/schema",
  "$id": "https://sdetkit.dev/schemas/adaptive-scenario-pack.schema.json",
  "title": "SDETKit adaptive scenario pack",
  "description": "Versioned scenario pack used by adaptive diagnosis to rank failure families and recommend review-first proof commands.",
  "type": "object",
  "additionalProperties": false,
  "required": ["schema_version", "pack_id", "title", "scenarios"],
  "properties": {
    "schema_version": {
      "const": "sdetkit.adaptive.scenario_pack.v1"
    },
    "pack_id": {
      "type": "string",
      "pattern": "^[a-z0-9][a-z0-9_.-]*$"
    },
    "title": {
      "type": "string",
      "minLength": 1
    },
    "scenarios": {
      "type": "array",
      "minItems": 1,
      "items": {
        "type": "object",
        "additionalProperties": false,
        "required": [
          "code",
          "title",
          "signals",
          "keywords",
          "checks",
          "commands",
          "risk_band",
          "prior_weight"
        ],
        "properties": {
          "code": {
            "type": "string",
            "pattern": "^[A-Z0-9_]+$"
          },
          "title": {
            "type": "string",
            "minLength": 1
          },
          "signals": {
            "type": "array",
            "minItems": 1,
            "items": {"type": "string", "minLength": 1},
            "uniqueItems": true
          },
          "keywords": {
            "type": "array",
            "minItems": 1,
            "items": {"type": "string", "minLength": 1},
            "uniqueItems": true
          },
          "checks": {
            "type": "array",
            "minItems": 1,
            "items": {"type": "string", "minLength": 1},
            "uniqueItems": true
          },
          "commands": {
            "type": "array",
            "minItems": 1,
            "items": {"type": "string", "minLength": 1},
            "uniqueItems": true
          },
          "odds": {
            "type": "array",
            "items": {"type": "string", "minLength": 1},
            "uniqueItems": true,
            "default": []
          },
          "tags": {
            "type": "array",
            "items": {"type": "string", "minLength": 1},
            "uniqueItems": true,
            "default": []
          },
          "risk_band": {
            "enum": ["low", "medium", "high"]
          },
          "prior_weight": {
            "type": "integer",
            "minimum": 1
          }
        }
      }
    }
  }
}
