{
  "pack_id": "sdetkit.built_in.adaptive_scenarios",
  "scenarios": [
    {
      "checks": [
        "Open the first failing pytest node and read the assertion delta before editing product code.",
        "Check whether fixtures, clocks, network fakes, or snapshots changed the expected contract."
      ],
      "code": "PYTEST_BEHAVIOR_REGRESSION",
      "commands": [
        "PYTHONPATH=src python -m pytest -q <first-failing-test> -vv"
      ],
      "keywords": [
        "assertionerror",
        "failed tests/",
        "== failures =="
      ],
      "odds": [],
      "prior_weight": 1,
      "risk_band": "medium",
      "signals": [
        "pytest-node-failed",
        "pytest-failed-count",
        "assertion-error"
      ],
      "title": "Pytest behavior regression"
    },
    {
      "checks": [
        "Inspect the first import exception and confirm the missing package or public API is declared.",
        "Check pyproject/requirements extras before changing runtime behavior."
      ],
      "code": "PYTEST_COLLECTION_IMPORT_FAILURE",
      "commands": [
        "PYTHONPATH=src python -m pytest -q <failing-test-file> --collect-only"
      ],
      "keywords": [
        "modulenotfounderror",
        "importerror while importing",
        "collected 0 items / 1 error"
      ],
      "odds": [],
      "prior_weight": 1,
      "risk_band": "medium",
      "signals": [
        "python-exception",
        "pytest-error-count",
        "traceback"
      ],
      "title": "Pytest collection/import failure"
    },
    {
      "checks": [
        "Run Ruff format on only touched Python files and verify the diff is format-only.",
        "Re-run Ruff format check after formatting."
      ],
      "code": "RUFF_FORMAT_DRIFT",
      "commands": [
        "PYTHONPATH=src python -m ruff format --check <touched-python-files>"
      ],
      "keywords": [
        "would reformat",
        "files were modified by this hook",
        "file reformatted"
      ],
      "odds": [],
      "prior_weight": 1,
      "risk_band": "medium",
      "signals": [
        "ruff-format-failure"
      ],
      "title": "Ruff format drift"
    },
    {
      "checks": [
        "Read the first Ruff rule code and separate safe mechanical F401/I001 from logic-risk rules.",
        "Only allow scoped auto-fix for the narrow safe allowlist."
      ],
      "code": "RUFF_LINT_CONTRACT",
      "commands": [
        "PYTHONPATH=src python -m ruff check <touched-python-files>"
      ],
      "keywords": [
        "ruff check",
        "[*]",
        "fixable with the --fix option"
      ],
      "odds": [],
      "prior_weight": 1,
      "risk_band": "medium",
      "signals": [
        "ruff-check-failure"
      ],
      "title": "Ruff lint contract failure"
    },
    {
      "checks": [
        "Open the first mypy error and identify whether the public contract or test double type drifted.",
        "Avoid blanket ignores until the narrow type boundary is understood."
      ],
      "code": "MYPY_CONTRACT_DRIFT",
      "commands": [
        "PYTHONPATH=src python -m mypy src tests"
      ],
      "keywords": [
        "mypy",
        "error:",
        "Found "
      ],
      "odds": [],
      "prior_weight": 1,
      "risk_band": "medium",
      "signals": [
        "mypy-error"
      ],
      "title": "Mypy type contract drift"
    },
    {
      "checks": [
        "Compare missing coverage lines to the PR diff and add focused tests for changed behavior.",
        "Do not lower the threshold unless the release owner explicitly approves policy change."
      ],
      "code": "COVERAGE_GATE_REGRESSION",
      "commands": [
        "bash quality.sh cov"
      ],
      "keywords": [
        "fail under",
        "total coverage",
        "coverage"
      ],
      "odds": [],
      "prior_weight": 1,
      "risk_band": "medium",
      "signals": [
        "coverage-failure"
      ],
      "title": "Coverage threshold regression"
    },
    {
      "checks": [
        "Scroll above the exit-code footer and identify the first actionable tool failure.",
        "Classify the failure before considering automation."
      ],
      "code": "CI_STEP_EXIT_NONZERO",
      "commands": [
        "python -m pre_commit run -a"
      ],
      "keywords": [
        "exit code",
        "command failed"
      ],
      "odds": [],
      "prior_weight": 1,
      "risk_band": "medium",
      "signals": [
        "ci-exit-code",
        "command-failed"
      ],
      "title": "CI step exited non-zero"
    },
    {
      "checks": [
        "Read the structured failed step list and map it to the first failing artifact.",
        "Check whether the policy failure is release-blocking or evidence-thin."
      ],
      "code": "QUALITY_GATE_POLICY_FAILURE",
      "commands": [
        "PYTHONPATH=src python -m sdetkit mission-control run --execute --doctor-cortex"
      ],
      "keywords": [
        "gate: problems found",
        "failed_steps",
        "no_ship"
      ],
      "odds": [],
      "prior_weight": 1,
      "risk_band": "medium",
      "signals": [
        "gate-problems-found",
        "failed-steps"
      ],
      "title": "Quality gate policy failure"
    },
    {
      "checks": [
        "Inspect the package-manager error block before retrying; dependency resolution may be the root cause.",
        "Check lockfiles and declared test requirements for drift."
      ],
      "code": "PACKAGE_INSTALL_FAILURE",
      "commands": [
        "python -m pip install -r requirements-test.txt -e ."
      ],
      "keywords": [
        "npm err!",
        "pnpm err!",
        "yarn",
        "pip install",
        "resolutionimpossible"
      ],
      "odds": [],
      "prior_weight": 1,
      "risk_band": "medium",
      "signals": [
        "package-manager-error"
      ],
      "title": "Package install or script failure"
    },
    {
      "checks": [
        "Identify the exact hook that failed and whether it changed files or reported a contract issue.",
        "If files changed, review the diff before committing generated changes."
      ],
      "code": "PRE_COMMIT_HOOK_FAILURE",
      "commands": [
        "python -m pre_commit run -a"
      ],
      "keywords": [
        "pre-commit",
        "hook",
        "files were modified by this hook"
      ],
      "odds": [],
      "prior_weight": 1,
      "risk_band": "medium",
      "signals": [
        "explicit-failed"
      ],
      "title": "Pre-commit hook failure"
    },
    {
      "checks": [
        "Start at the last frame in the first traceback and identify the smallest product or test boundary.",
        "Check whether the exception happens during setup, import, or exercised behavior."
      ],
      "code": "RUNTIME_EXCEPTION",
      "commands": [
        "PYTHONPATH=src python -m pytest -q <focused-test> -vv"
      ],
      "keywords": [
        "traceback",
        "exception:",
        "error:"
      ],
      "odds": [],
      "prior_weight": 1,
      "risk_band": "medium",
      "signals": [
        "traceback",
        "python-exception",
        "error-prefix"
      ],
      "title": "Runtime exception or traceback"
    },
    {
      "checks": [
        "Separate local filesystem/package friction from product failures before changing code.",
        "Re-run from a native Linux filesystem or clean virtual environment if needed."
      ],
      "code": "LOCAL_ENVIRONMENT_FRICTION",
      "commands": [
        "python -m venv .venv"
      ],
      "keywords": [
        "/mnt/c/",
        "keyboardinterrupt",
        "venv",
        "site-packages"
      ],
      "odds": [],
      "prior_weight": 1,
      "risk_band": "medium",
      "signals": [
        "command-failed"
      ],
      "title": "Local environment friction"
    },
    {
      "checks": [
        "Fetch and compare remote branch state before pushing or rewriting commits.",
        "Re-run proof after rebase because previous proof may be stale."
      ],
      "code": "GIT_REMOTE_DRIFT",
      "commands": [
        "git fetch --all --prune",
        "git status --short --branch"
      ],
      "keywords": [
        "non-fast-forward",
        "fetch first",
        "remote contains work",
        "rebase"
      ],
      "odds": [],
      "prior_weight": 1,
      "risk_band": "medium",
      "signals": [
        "error-prefix",
        "command-failed"
      ],
      "title": "Git branch or remote drift"
    },
    {
      "checks": [
        "Check the async test marker, fixture scope, and client lifecycle before changing production async code.",
        "Reproduce one async test with verbose traceback and no parallelism."
      ],
      "code": "ASYNC_EVENT_LOOP_MISMATCH",
      "commands": [
        "PYTHONPATH=src python -m pytest -q <async-test> -vv"
      ],
      "keywords": [
        "event loop is closed",
        "pytest-asyncio",
        "anyio",
        "asyncio.run",
        "attached to a different loop"
      ],
      "odds": [],
      "prior_weight": 1,
      "risk_band": "medium",
      "signals": [
        "python-exception",
        "pytest-error-count"
      ],
      "title": "Async event loop or fixture mismatch"
    },
    {
      "checks": [
        "Inspect the expected/received diff and confirm whether the contract intentionally changed.",
        "Update golden files only after a focused behavior test proves the new output."
      ],
      "code": "SNAPSHOT_GOLDEN_DRIFT",
      "commands": [
        "PYTHONPATH=src python -m pytest -q <snapshot-test> -vv"
      ],
      "keywords": [
        "snapshot",
        "golden",
        "approval",
        "received",
        "expected"
      ],
      "odds": [],
      "prior_weight": 1,
      "risk_band": "medium",
      "signals": [
        "pytest-node-failed",
        "assertion-error"
      ],
      "title": "Snapshot or golden-file drift"
    },
    {
      "checks": [